{
  "schema_version": "formula-known-patterns.v1",
  "last_updated": "2026-05-31",
  "noisy_form_recovery": {
    "ТН100Т=_(вр)": "Н_(тп) = Т_(тп) × 100 / Т_(вр)",
    "ЗЗt=_(м)": "З_(ч) = З_(срм) / t_(м)",
    "ККЧ=_(факт)": "К_(ср) = К_(уч) / Ч_(факт)",
    "ТКЧТКН=_(учiВрП)": "К_(уч) = ТК × Ч_(i) × Т_(1раб) / Н_(ВрП)",
    "ТН=_(рабВрЭ1раб)^(1)": "Т_(1раб) = sum Н_(ВрЭ1раб)",
    "ККЧ=_(учКсрКобщ)": "К_(срК) = К_(учК) / Ч_(общ)",
    "ТКЧТКТ=_(КАМобщ)": "К_(учК) = ТК × Ч_(i) × Т_(КАМ1) / Т_(КАМобщ)",
    "ДЗН100С=": "Н_(ДЗ) = ДЗ × 100 / С_(р)",
    "ТКЧТКТ=_(Ообщ)": "К_(учО) = ТК_(о) × Ч_(Оi) × Т_(Оi) / Т_(Ообщ)",
    "ККЧ=_(Побщ)": "К_(срО) = К_(учО) / Ч_(Ообщ)",
    "ССИ=_(ТСоТС)": "С_(ТСо) = СИ_(ТС)",
    "С(ЦЭ)=_(МоММо)": "С_(Мо) = Ц_(М) × Э_(Мо)",
    "ЗТЧ100Н[100(НН)]60=-+_(ВрИпзро)": "Н_(ВрИ) = ЗТ_(Иср) × 100 / (Ч_(общ) × [100 - (Н_(пзр) + Н_(о))] × 60)",
    "ЗТЧ100Н[100(НН)]60=-+_(ВрЭлпзро)": "Н_(ВрЭл) = ЗТ_(эСРл) × 100 / (Ч_(общ) × [100 - (Н_(пзр) + Н_(о))] × 60)",
    "ЗТЗТn=_(Исрф)": "ЗТ_(Иср) = sum_(ф=1)^n_(ф) ЗТ_(1факт) / n_(ф)",
    "ЗЗТV=_(фактф)^(1)": "ЗТ_(1факт) = ЗТ_(Vфакт) / V_(ф)",
    "С(ИЦ)=_(ТСТСiТСi)": "С_(ТС) = sum_(i) И_(ТСi) × Ц_(ТСi)",
    "ВАН=_(с)": "А_(ТС) = В_(с) / Н_(с)",
    "НРАС100=": "Р_(ТС) = Н_(р) × А_(ТС) × С_(с) / 100",
    "С(ЭЦ)=_(ММiМi)": "С_(М) = sum_(i) Э_(Мi) × Ц_(Мi)",
    "С(МЦ)=_(матiматi)": "С_(мат) = sum_(i) М_(i) × Ц_(матi)"
  },
  "formula_representations": [
    {
      "linear_text": "М_(тек) = sum_(j=1)^J P^(j) × См_(тек)^(j)",
      "source_format": "mathtype_wmf_text_records",
      "display_latex": "\\mathrm{М}_{\\text{тек}} = \\sum_{j=1}^{J} P^{j} \\times \\mathrm{См}_{\\text{тек}}^{j}",
      "calc_expr": "M_tek = sum(P[j] * Sm_tek[j] for j in range(1, J + 1))",
      "variables": {
        "М_тек": "M_tek",
        "P_j": "P[j]",
        "См_тек_j": "Sm_tek[j]",
        "J": "J"
      },
      "confidence": "medium",
      "warnings": ["calculation_expression_requires_domain_variable_binding"]
    },
    {
      "linear_text": "ОТ_(тек) = sum_(i=1)^I ЗТ_(i) × СЦ_(ЗТтек)^(i) × V_(i)",
      "source_format": "mathtype_wmf_text_records",
      "display_latex": "\\mathrm{ОТ}_{\\text{тек}} = \\sum_{i=1}^{I} \\mathrm{ЗТ}_{i} \\times \\mathrm{СЦ}_{\\text{ЗТтек}}^{i} \\times V_{i}",
      "calc_expr": "OT_tek = sum(ZT[i] * SC_ZT_tek[i] * V[i] for i in range(1, I + 1))",
      "variables": {
        "ОТ_тек": "OT_tek",
        "ЗТ_i": "ZT[i]",
        "СЦ_ЗТтек_i": "SC_ZT_tek[i]",
        "V_i": "V[i]",
        "I": "I"
      },
      "confidence": "medium",
      "warnings": ["calculation_expression_requires_domain_variable_binding"]
    },
    {
      "linear_text": "ОТ_(тек) = sum_(i=1)^I sum_(n=1)^N ЗТ_(ni) × СЦ_(n) × V_(i)",
      "source_format": "mathtype_wmf_text_records",
      "display_latex": "\\mathrm{ОТ}_{\\text{тек}} = \\sum_{i=1}^{I} \\sum_{n=1}^{N} \\mathrm{ЗТ}_{ni} \\times \\mathrm{СЦ}_{n} \\times V_{i}",
      "calc_expr": "OT_tek = sum(ZT[n, i] * SC[n] * V[i] for i in range(1, I + 1) for n in range(1, N + 1))",
      "variables": {
        "ОТ_тек": "OT_tek",
        "ЗТ_ni": "ZT[n, i]",
        "СЦ_n": "SC[n]",
        "V_i": "V[i]",
        "I": "I",
        "N": "N"
      },
      "confidence": "medium",
      "warnings": ["calculation_expression_requires_domain_variable_binding"]
    },
    {
      "linear_text": "ОТм_(тек) = sum_(i=1)^I sum_(k=1)^K ЗТ_(ki) × СЦ_(k) × V_(i)",
      "source_format": "mathtype_wmf_text_records",
      "display_latex": "\\mathrm{ОТм}_{\\text{тек}} = \\sum_{i=1}^{I} \\sum_{k=1}^{K} \\mathrm{ЗТ}_{ki} \\times \\mathrm{СЦ}_{k} \\times V_{i}",
      "calc_expr": "OTm_tek = sum(ZT[k, i] * SC[k] * V[i] for i in range(1, I + 1) for k in range(1, K + 1))",
      "variables": {
        "ОТм_тек": "OTm_tek",
        "ЗТ_ki": "ZT[k, i]",
        "СЦ_k": "SC[k]",
        "V_i": "V[i]",
        "I": "I",
        "K": "K"
      },
      "confidence": "medium",
      "warnings": ["calculation_expression_requires_domain_variable_binding"]
    },
    {
      "linear_text": "ЭММ_(тек) = sum_(m=1)^M T_(m) × СЦэм_(тек)^(m)",
      "source_format": "mathtype_wmf_text_records",
      "display_latex": "\\mathrm{ЭММ}_{\\text{тек}} = \\sum_{m=1}^{M} T_{m} \\times \\mathrm{СЦэм}_{\\text{тек}}^{m}",
      "calc_expr": "EMM_tek = sum(T[m] * SCem_tek[m] for m in range(1, M + 1))",
      "variables": {
        "ЭММ_тек": "EMM_tek",
        "T_m": "T[m]",
        "СЦэм_тек_m": "SCem_tek[m]",
        "M": "M"
      },
      "confidence": "medium",
      "warnings": ["calculation_expression_requires_domain_variable_binding"]
    },
    {
      "linear_text": "З_(ср) = З_(1) × К_(смрТ)",
      "source_format": "mathtype_wmf_text_records",
      "display_latex": "\\mathrm{З}_{\\text{ср}} = \\mathrm{З}_{1} \\times \\mathrm{К}_{\\text{смрТ}}",
      "calc_expr": "Z_sr = Z_1 * K_smrT",
      "variables": {
        "З_ср": "Z_sr",
        "З_1": "Z_1",
        "К_смрТ": "K_smrT"
      },
      "confidence": "medium",
      "warnings": ["formula_native_wmf_pattern_recovered"]
    },
    {
      "linear_text": "З_(пнр) = sum_(i) Т_(i) × З_(i)",
      "source_format": "mathtype_wmf_text_records",
      "display_latex": "\\mathrm{З}_{\\text{пнр}} = \\sum_{i} T_{i} \\times \\mathrm{З}_{i}",
      "calc_expr": "Z_pnr = sum(T[i] * Z[i] for i in I)",
      "variables": {
        "З_пнр": "Z_pnr",
        "Т_i": "T[i]",
        "З_i": "Z[i]",
        "I": "I"
      },
      "confidence": "medium",
      "warnings": [
        "formula_native_wmf_pattern_recovered",
        "calculation_expression_requires_domain_variable_binding"
      ]
    },
    {
      "linear_text": "З_(i) = З_(1) × К_(пнрТ)^(i)",
      "source_format": "mathtype_wmf_text_records",
      "display_latex": "\\mathrm{З}_{i} = \\mathrm{З}_{1} \\times \\mathrm{К}_{\\text{пнрТ}}^{i}",
      "calc_expr": "Z_i = Z_1 * K_pnrT[i]",
      "variables": {
        "З_i": "Z_i",
        "З_1": "Z_1",
        "К_пнрТ_i": "K_pnrT[i]"
      },
      "confidence": "medium",
      "warnings": [
        "formula_native_wmf_pattern_recovered",
        "calculation_expression_requires_domain_variable_binding"
      ]
    },
    {
      "linear_text": "Н_(ВрП) = sum Н_(ВрЭ)",
      "source_format": "mathtype_wmf_text_records",
      "display_latex": "\\mathrm{Н}_{\\text{ВрП}} = \\sum \\mathrm{Н}_{\\text{ВрЭ}}",
      "calc_expr": "N_VrP = sum(N_VrE)",
      "variables": {
        "Н_ВрП": "N_VrP",
        "Н_ВрЭ": "N_VrE"
      },
      "confidence": "medium",
      "warnings": [
        "formula_native_wmf_pattern_recovered",
        "calculation_expression_requires_domain_variable_binding"
      ]
    },
    {
      "linear_text": "Н_(ВрЭ) = ЗТ_(эСР) × 100 / (Ч_(факт) × [100 - (Н_(пзр) + Н_(о) + Н_(тп))] × 60)",
      "source_format": "mathtype_wmf_text_records",
      "display_latex": "\\mathrm{Н}_{\\text{ВрЭ}} = \\frac{\\mathrm{ЗТ}_{\\text{эСР}} \\times 100}{\\mathrm{Ч}_{\\text{факт}} \\times \\left(100 - (\\mathrm{Н}_{\\text{пзр}} + \\mathrm{Н}_{\\text{о}} + \\mathrm{Н}_{\\text{тп}})\\right) \\times 60}",
      "calc_expr": "N_VrE = ZT_eSR * 100 / (Ch_fact * (100 - (N_pzr + N_o + N_tp)) * 60)",
      "variables": {
        "Н_ВрЭ": "N_VrE",
        "ЗТ_эСР": "ZT_eSR",
        "Ч_факт": "Ch_fact",
        "Н_пзр": "N_pzr",
        "Н_о": "N_o",
        "Н_тп": "N_tp"
      },
      "confidence": "medium",
      "warnings": ["formula_native_wmf_pattern_recovered"]
    },
    {
      "linear_text": "Н_(тп) = Т_(тп) × 100 / Т_(вр)",
      "source_format": "mathtype_wmf_text_records",
      "display_latex": "\\mathrm{Н}_{\\text{тп}} = \\frac{\\mathrm{Т}_{\\text{тп}} \\times 100}{\\mathrm{Т}_{\\text{вр}}}",
      "calc_expr": "N_tp = T_tp * 100 / T_vr",
      "variables": {
        "Н_тп": "N_tp",
        "Т_тп": "T_tp",
        "Т_вр": "T_vr"
      },
      "confidence": "medium",
      "warnings": ["formula_native_wmf_pattern_recovered"]
    },
    {
      "linear_text": "З_(ч) = З_(срм) / t_(м)",
      "source_format": "mathtype_wmf_text_records",
      "display_latex": "\\mathrm{З}_{\\text{ч}} = \\frac{\\mathrm{З}_{\\text{срм}}}{t_{\\text{м}}}",
      "calc_expr": "Z_ch = Z_srm / t_m",
      "variables": {
        "З_ч": "Z_ch",
        "З_срм": "Z_srm",
        "t_м": "t_m"
      },
      "confidence": "medium",
      "warnings": ["formula_native_wmf_pattern_recovered"]
    },
    {
      "linear_text": "К_(ср) = К_(уч) / Ч_(факт)",
      "source_format": "mathtype_wmf_text_records",
      "display_latex": "\\mathrm{К}_{\\text{ср}} = \\frac{\\mathrm{К}_{\\text{уч}}}{\\mathrm{Ч}_{\\text{факт}}}",
      "calc_expr": "K_sr = K_uch / Ch_fact",
      "variables": {
        "К_ср": "K_sr",
        "К_уч": "K_uch",
        "Ч_факт": "Ch_fact"
      },
      "confidence": "medium",
      "warnings": ["formula_native_wmf_pattern_recovered"]
    },
    {
      "linear_text": "К_(уч) = ТК × Ч_(i) × Т_(1раб) / Н_(ВрП)",
      "source_format": "mathtype_wmf_text_records",
      "display_latex": "\\mathrm{К}_{\\text{уч}} = \\frac{\\mathrm{ТК} \\times \\mathrm{Ч}_{i} \\times \\mathrm{Т}_{1\\text{раб}}}{\\mathrm{Н}_{\\text{ВрП}}}",
      "calc_expr": "K_uch = TK * Ch_i * T_1rab / N_VrP",
      "variables": {
        "К_уч": "K_uch",
        "ТК": "TK",
        "Ч_i": "Ch_i",
        "Т_1раб": "T_1rab",
        "Н_ВрП": "N_VrP"
      },
      "confidence": "medium",
      "warnings": ["formula_native_wmf_pattern_recovered"]
    },
    {
      "linear_text": "Т_(1раб) = sum Н_(ВрЭ1раб)",
      "source_format": "mathtype_wmf_text_records",
      "display_latex": "\\mathrm{Т}_{1\\text{раб}} = \\sum \\mathrm{Н}_{\\text{ВрЭ1раб}}",
      "calc_expr": "T_1rab = sum(N_VrE1rab)",
      "variables": {
        "Т_1раб": "T_1rab",
        "Н_ВрЭ1раб": "N_VrE1rab"
      },
      "confidence": "medium",
      "warnings": [
        "formula_native_wmf_pattern_recovered",
        "calculation_expression_requires_domain_variable_binding"
      ]
    },
    {
      "linear_text": "К_(срК) = К_(учК) / Ч_(общ)",